{
  "author": "Lablab Bean Team",
  "capabilities": [
    "demo",
    "test"
  ],
  "dependencies": [],
  "description": "A simple demo plugin to validate the plugin system",
  "entryPoint": {
    "dotnet.console": "LablabBean.Plugin.Demo.dll,LablabBean.Plugin.Demo.DemoPlugin",
    "dotnet.sadconsole": "LablabBean.Plugin.Demo.dll,LablabBean.Plugin.Demo.DemoPlugin"
  },
  "id": "demo-plugin",
  "name": "Demo Plugin",
  "priority": 100,
  "version": "1.0.0"
}
